\c table_name_test_db
set lower_case_table_names = 0;
DROP TABLE IF EXISTS PUBLIC.Test;
NOTICE:  table "Test" does not exist, skipping
CREATE TABLE PUBLIC.Test (a int);
SELECT PUBLIC.Test.A FROM PUBLIC.Test WHERE PUBLIC.Test.A <> 2;
 a 
---
(0 rows)

INSERT INTO PUBLIC.Test(A) VALUES(1), (2), (3);
UPDATE PUBLIC.Test SET Test.A = (PUBLIC.Test.A + 1) WHERE PUBLIC.Test.A > 1;
SELECT PUBLIC.Test.A FROM PUBLIC.Test;
 a 
---
 1
 3
 4
(3 rows)

DELETE FROM PUBLIC.Test WHERE PUBLIC.Test.A <= 1;
SELECT PUBLIC.Test.A FROM PUBLIC.Test;
 a 
---
 3
 4
(2 rows)

create table T1(AA int);
insert into T1 values(1);
update T1 set aa=2 where aa=1;
insert into T1 set aa=1;
select * from T1;
 aa 
----
  2
  1
(2 rows)

create table T2(AA int);
insert into T2 values(1);
update T2 set aa=2 where aa=1;
insert into T2 set aa=1;
select * from T2;
 aa 
----
  2
  1
(2 rows)

update T1,T2 set T1.aa=1, T2.aa=2;
DELETE FROM T1, T2 USING T1, T2 WHERE T1.aa = T2.aa;
