\c table_name_test_db;
set dolphin.lower_case_table_names TO 0;
--
-- MERGE INTO 
--
-- initial
CREATE SCHEMA mergeinto;
SET current_schema = mergeinto;
CREATE TABLE Products_Base
(
product_id INTEGER DEFAULT 0,
product_name VARCHAR(60) DEFAULT 'null',
category VARCHAR(60) DEFAULT 'unknown',
total INTEGER DEFAULT '0'
);
INSERT INTO Products_Base VALUES (1501, 'vivitar 35mm', 'electrncs', 100);
INSERT INTO Products_Base VALUES (1502, 'olympus is50', 'electrncs', 100);
INSERT INTO Products_Base VALUES (1600, 'play gym', 'toys', 100);
INSERT INTO Products_Base VALUES (1601, 'lamaze', 'toys', 100);
INSERT INTO Products_Base VALUES (1666, 'harry potter', 'dvd', 100);
CREATE TABLE NewProducts_Base
(
product_id INTEGER DEFAULT 0,
product_name VARCHAR(60) DEFAULT 'null',
category VARCHAR(60) DEFAULT 'unknown',
total INTEGER DEFAULT '0'
);
INSERT INTO NewProducts_Base VALUES (1502, 'olympus camera', 'electrncs', 200);
INSERT INTO NewProducts_Base VALUES (1601, 'lamaze', 'toys', 200);
INSERT INTO NewProducts_Base VALUES (1666, 'harry potter', 'toys', 200);
INSERT INTO NewProducts_Base VALUES (1700, 'wait interface', 'books', 200);
ANALYZE Products_Base;
ANALYZE NewProducts_Base;
--
-- stream mode(MERGE can be pushed down), row table
--
CREATE TABLE Products_Row
(
product_id INTEGER DEFAULT 0,
product_name VARCHAR(60) DEFAULT 'null',
category VARCHAR(60) DEFAULT 'unknown',
total INTEGER DEFAULT '0'
);
CREATE TABLE NewProducts_Row
(
product_id INTEGER DEFAULT 0,
product_name VARCHAR(60) DEFAULT 'null',
category VARCHAR(60) DEFAULT 'unknown',
total INTEGER DEFAULT '0'
);
INSERT INTO Products_Row SELECT * FROM Products_Base;
INSERT INTO NewProducts_Row SELECT * FROM NewProducts_Base;
ANALYZE Products_Row;
ANALYZE NewProducts_Row;
-- explain verbose
EXPLAIN (VERBOSE on, COSTS off)
MERGE INTO Products_Row P
USING NewProducts_Row NP
ON p.product_id = np.product_id
WHEN MATCHED THEN
  UPDATE SET product_name = np.product_name, category = np.category, total = np.total
WHEN NOT MATCHED THEN  
  INSERT VALUES (np.product_id, np.product_name, np.category, np.total);
ERROR:  missing FROM-clause entry for table "p"
LINE 4: ON p.product_id = np.product_id
           ^
EXPLAIN (VERBOSE on, COSTS off)
MERGE INTO Products_Row p
USING NewProducts_Row np
ON p.product_id = np.product_id
WHEN MATCHED THEN
  UPDATE SET product_name = np.product_name, category = np.category, total = np.total
WHEN NOT MATCHED THEN  
  INSERT VALUES (np.product_id, np.product_name, np.category, np.total);
                                                                QUERY PLAN                                                                 
-------------------------------------------------------------------------------------------------------------------------------------------
 Merge on mergeinto."Products_Row" p
   ->  Hash Right Join
         Output: np.product_id, np.product_name, np.category, np.total, p.product_id, p.product_name, p.category, p.total, p.ctid, np.ctid
         Hash Cond: (p.product_id = np.product_id)
         ->  Seq Scan on mergeinto."Products_Row" p
               Output: p.product_id, p.product_name, p.category, p.total, p.ctid
         ->  Hash
               Output: np.product_id, np.product_name, np.category, np.total, np.ctid
               ->  Seq Scan on mergeinto."NewProducts_Row" np
                     Output: np.product_id, np.product_name, np.category, np.total, np.ctid
(10 rows)

-- only MATCHED clause
MERGE INTO Products_Row p
USING NewProducts_Row np
ON p.product_id = np.product_id
WHEN MATCHED THEN
  UPDATE SET product_name = np.product_name, category = np.category, total = np.total;
SELECT * FROM Products_Row ORDER BY 1;
 product_id |  product_name  | category  | total 
------------+----------------+-----------+-------
       1501 | vivitar 35mm   | electrncs |   100
       1502 | olympus camera | electrncs |   200
       1600 | play gym       | toys      |   100
       1601 | lamaze         | toys      |   200
       1666 | harry potter   | toys      |   200
(5 rows)

-- only MATCHED clause, has expressions
TRUNCATE Products_Row;
INSERT INTO Products_Row SELECT * FROM Products_Base;
MERGE INTO Products_Row p
USING NewProducts_Row np
ON p.product_id = np.product_id
WHEN MATCHED THEN
  UPDATE SET product_name = np.product_name, category = np.category || 'ABC', total = np.total + 100;
SELECT * FROM Products_Row ORDER BY 1;
 product_id |  product_name  |   category   | total 
------------+----------------+--------------+-------
       1501 | vivitar 35mm   | electrncs    |   100
       1502 | olympus camera | electrncsABC |   300
       1600 | play gym       | toys         |   100
       1601 | lamaze         | toysABC      |   300
       1666 | harry potter   | toysABC      |   300
(5 rows)

-- only NOT MATCHED clause
TRUNCATE Products_Row;
INSERT INTO Products_Row SELECT * FROM Products_Base;
MERGE INTO Products_Row p
USING NewProducts_Row np
ON p.product_id = np.product_id
WHEN NOT MATCHED THEN  
  INSERT VALUES (np.product_id, np.product_name, np.category, np.total);
SELECT * FROM Products_Row ORDER BY 1;
 product_id |  product_name  | category  | total 
------------+----------------+-----------+-------
       1501 | vivitar 35mm   | electrncs |   100
       1502 | olympus is50   | electrncs |   100
       1600 | play gym       | toys      |   100
       1601 | lamaze         | toys      |   100
       1666 | harry potter   | dvd       |   100
       1700 | wait interface | books     |   200
(6 rows)

TRUNCATE Products_Row;
INSERT INTO Products_Row SELECT * FROM Products_Base;
MERGE INTO Products_Row p
USING NewProducts_Row np
ON p.product_id = np.product_id
WHEN NOT MATCHED THEN  
  INSERT VALUES (np.product_id, np.product_name, np.category);
SELECT * FROM Products_Row ORDER BY 1;
 product_id |  product_name  | category  | total 
------------+----------------+-----------+-------
       1501 | vivitar 35mm   | electrncs |   100
       1502 | olympus is50   | electrncs |   100
       1600 | play gym       | toys      |   100
       1601 | lamaze         | toys      |   100
       1666 | harry potter   | dvd       |   100
       1700 | wait interface | books     |     0
(6 rows)

-- only NOT MATCHED clause has insert targetlist
TRUNCATE Products_Row;
INSERT INTO Products_Row SELECT * FROM Products_Base;
MERGE INTO Products_Row p
USING NewProducts_Row np
ON p.product_id = np.product_id
WHEN NOT MATCHED THEN 
  INSERT (product_id, total) VALUES (np.product_id, np.total); --notice: we have 2 fields missing
SELECT * FROM Products_Row ORDER BY 1;
 product_id | product_name | category  | total 
------------+--------------+-----------+-------
       1501 | vivitar 35mm | electrncs |   100
       1502 | olympus is50 | electrncs |   100
       1600 | play gym     | toys      |   100
       1601 | lamaze       | toys      |   100
       1666 | harry potter | dvd       |   100
       1700 | null         | unknown   |   200
(6 rows)

TRUNCATE Products_Row;
INSERT INTO Products_Row SELECT * FROM Products_Base;
MERGE INTO Products_Row p
USING NewProducts_Row np
ON p.product_id = np.product_id
WHEN NOT MATCHED THEN  
  INSERT (product_id, total) VALUES (np.product_id, np.total); --notice: we have 2 fields missing
SELECT * FROM Products_Row ORDER BY 1;
 product_id | product_name | category  | total 
------------+--------------+-----------+-------
       1501 | vivitar 35mm | electrncs |   100
       1502 | olympus is50 | electrncs |   100
       1600 | play gym     | toys      |   100
       1601 | lamaze       | toys      |   100
       1666 | harry potter | dvd       |   100
       1700 | null         | unknown   |   200
(6 rows)

-- only NOT MATCHED clause has insert targetlist
TRUNCATE Products_Row;
INSERT INTO Products_Row SELECT * FROM Products_Base;
MERGE INTO Products_Row p
USING NewProducts_Row np
ON p.product_id = np.product_id
WHEN NOT MATCHED THEN 
  INSERT (total, product_id) VALUES (np.total, np.product_id); --notice: 2 fields missing and reversed
SELECT * FROM Products_Row ORDER BY 1;
 product_id | product_name | category  | total 
------------+--------------+-----------+-------
       1501 | vivitar 35mm | electrncs |   100
       1502 | olympus is50 | electrncs |   100
       1600 | play gym     | toys      |   100
       1601 | lamaze       | toys      |   100
       1666 | harry potter | dvd       |   100
       1700 | null         | unknown   |   200
(6 rows)

TRUNCATE Products_Row;
INSERT INTO Products_Row SELECT * FROM Products_Base;
MERGE INTO Products_Row p
USING NewProducts_Row np
ON p.product_id = np.product_id
WHEN NOT MATCHED THEN  
  INSERT (total, product_id) VALUES (np.total, np.product_id); --notice: 2 fields missing and reversed
SELECT * FROM Products_Row ORDER BY 1;
 product_id | product_name | category  | total 
------------+--------------+-----------+-------
       1501 | vivitar 35mm | electrncs |   100
       1502 | olympus is50 | electrncs |   100
       1600 | play gym     | toys      |   100
       1601 | lamaze       | toys      |   100
       1666 | harry potter | dvd       |   100
       1700 | null         | unknown   |   200
(6 rows)

-- only NOT MATCHED clause, has expressions
TRUNCATE Products_Row;
INSERT INTO Products_Row SELECT * FROM Products_Base;
MERGE INTO Products_Row p
USING NewProducts_Row np
ON p.product_id = np.product_id
WHEN NOT MATCHED THEN  
  INSERT VALUES (np.product_id, np.product_name, np.category || 'ABC', np.total + 100);
SELECT * FROM Products_Row ORDER BY 1;
 product_id |  product_name  | category  | total 
------------+----------------+-----------+-------
       1501 | vivitar 35mm   | electrncs |   100
       1502 | olympus is50   | electrncs |   100
       1600 | play gym       | toys      |   100
       1601 | lamaze         | toys      |   100
       1666 | harry potter   | dvd       |   100
       1700 | wait interface | booksABC  |   300
(6 rows)

-- both MATCHED and NOT MATCHED clause
TRUNCATE Products_Row;
INSERT INTO Products_Row SELECT * FROM Products_Base;
MERGE INTO Products_Row p
USING NewProducts_Row np
ON p.product_id = np.product_id
WHEN MATCHED THEN
  UPDATE SET product_name = np.product_name, category = np.category, total = np.total
WHEN NOT MATCHED THEN  
  INSERT VALUES (np.product_id, np.product_name, np.category, np.total);
SELECT * FROM Products_Row ORDER BY 1;
 product_id |  product_name  | category  | total 
------------+----------------+-----------+-------
       1501 | vivitar 35mm   | electrncs |   100
       1502 | olympus camera | electrncs |   200
       1600 | play gym       | toys      |   100
       1601 | lamaze         | toys      |   200
       1666 | harry potter   | toys      |   200
       1700 | wait interface | books     |   200
(6 rows)

-- both MATCHED and NOT MATCHED clause has constant qual
TRUNCATE Products_Row;
INSERT INTO Products_Row SELECT * FROM Products_Base;
MERGE INTO Products_Row p
USING NewProducts_Row np
ON p.product_id = np.product_id AND 1=1
WHEN MATCHED THEN
  UPDATE SET product_name = np.product_name, category = np.category, total = np.total
WHEN NOT MATCHED THEN  
  INSERT VALUES (np.product_id, np.product_name, np.category, np.total);
SELECT * FROM Products_Row ORDER BY 1,2,3,4;
 product_id |  product_name  | category  | total 
------------+----------------+-----------+-------
       1501 | vivitar 35mm   | electrncs |   100
       1502 | olympus camera | electrncs |   200
       1600 | play gym       | toys      |   100
       1601 | lamaze         | toys      |   200
       1666 | harry potter   | toys      |   200
       1700 | wait interface | books     |   200
(6 rows)

-- both MATCHED and NOT MATCHED clause has constant qual with subquery
TRUNCATE Products_Row;
INSERT INTO Products_Row SELECT * FROM Products_Base;
MERGE INTO Products_Row p
USING NewProducts_Row np
ON p.product_id = np.product_id AND 1=(select total from Products_Row order by 1 limit 1)
WHEN MATCHED THEN
  UPDATE SET product_name = np.product_name, category = np.category, total = np.total
WHEN NOT MATCHED THEN  
  INSERT VALUES (np.product_id, np.product_name, np.category, np.total);
SELECT * FROM Products_Row ORDER BY 1,2,3,4;
 product_id |  product_name  | category  | total 
------------+----------------+-----------+-------
       1501 | vivitar 35mm   | electrncs |   100
       1502 | olympus camera | electrncs |   200
       1502 | olympus is50   | electrncs |   100
       1600 | play gym       | toys      |   100
       1601 | lamaze         | toys      |   100
       1601 | lamaze         | toys      |   200
       1666 | harry potter   | dvd       |   100
       1666 | harry potter   | toys      |   200
       1700 | wait interface | books     |   200
(9 rows)

-- both MATCHED and NOT MATCHED clause, has expressions
TRUNCATE Products_Row;
INSERT INTO Products_Row SELECT * FROM Products_Base;
MERGE INTO Products_Row p
USING NewProducts_Row np
ON p.product_id = np.product_id
WHEN MATCHED THEN
  UPDATE SET product_name = np.product_name, category = np.category || 'ABC', total = np.total + 100
WHEN NOT MATCHED THEN  
  INSERT VALUES (np.product_id, np.product_name, np.category || 'ABC', np.total + 100);
SELECT * FROM Products_Row ORDER BY 1;
 product_id |  product_name  |   category   | total 
------------+----------------+--------------+-------
       1501 | vivitar 35mm   | electrncs    |   100
       1502 | olympus camera | electrncsABC |   300
       1600 | play gym       | toys         |   100
       1601 | lamaze         | toysABC      |   300
       1666 | harry potter   | toysABC      |   300
       1700 | wait interface | booksABC     |   300
(6 rows)

MERGE INTO Products_Row p
USING NewProducts_Row np
ON p.product_id = np.product_id
WHEN MATCHED THEN
  UPDATE SET product_name = p.product_name, category = p.category || 'ABC', total = p.total + 100
WHEN NOT MATCHED THEN  
  INSERT VALUES (np.product_id, np.product_name, np.category || 'ABC', np.total + 100);
SELECT * FROM Products_Row ORDER BY 1;
 product_id |  product_name  |    category     | total 
------------+----------------+-----------------+-------
       1501 | vivitar 35mm   | electrncs       |   100
       1502 | olympus camera | electrncsABCABC |   400
       1600 | play gym       | toys            |   100
       1601 | lamaze         | toysABCABC      |   400
       1666 | harry potter   | toysABCABC      |   400
       1700 | wait interface | booksABCABC     |   400
(6 rows)

-- both MATCHED and NOT MATCHED clause, has expressions, has WHERE conditions
TRUNCATE Products_Row;
INSERT INTO Products_Row SELECT * FROM Products_Base;
MERGE INTO Products_Row p
USING NewProducts_Row np
ON p.product_id = np.product_id
WHEN MATCHED THEN
  UPDATE SET product_name = np.product_name, category = np.category || 'ABC', total = np.total + 100 WHERE p.category = 'dvd'
WHEN NOT MATCHED THEN  
  INSERT VALUES (np.product_id, np.product_name, np.category || 'ABC', np.total + 100) WHERE np.category != 'books';
SELECT * FROM Products_Row ORDER BY 1;
 product_id | product_name | category  | total 
------------+--------------+-----------+-------
       1501 | vivitar 35mm | electrncs |   100
       1502 | olympus is50 | electrncs |   100
       1600 | play gym     | toys      |   100
       1601 | lamaze       | toys      |   100
       1666 | harry potter | toysABC   |   300
(5 rows)

-- both MATCHED and NOT MATCHED clause, has expressions, which WHERE conditions is constant
TRUNCATE Products_Row;
INSERT INTO Products_Row SELECT * FROM Products_Base;
MERGE INTO Products_Row p
USING NewProducts_Row np
ON p.product_id = np.product_id
WHEN MATCHED THEN
  UPDATE SET product_name = np.product_name, category = np.category || 'ABC', total = np.total + 100 WHERE true
WHEN NOT MATCHED THEN  
  INSERT VALUES (np.product_id, np.product_name, np.category || 'ABC', np.total + 100) WHERE false;
SELECT * FROM Products_Row ORDER BY 1;
 product_id |  product_name  |   category   | total 
------------+----------------+--------------+-------
       1501 | vivitar 35mm   | electrncs    |   100
       1502 | olympus camera | electrncsABC |   300
       1600 | play gym       | toys         |   100
       1601 | lamaze         | toysABC      |   300
       1666 | harry potter   | toysABC      |   300
(5 rows)

-- both MATCHED and NOT MATCHED clause, has expressions, has WHERE conditions
TRUNCATE Products_Row;
INSERT INTO Products_Row SELECT * FROM Products_Base;
MERGE INTO Products_Row p
USING NewProducts_Row np
ON p.product_id = np.product_id
WHEN MATCHED THEN
  UPDATE SET product_name = np.product_name, category = np.category || 'ABC', total = np.total + 100
  WHERE p.category = 'dvd' AND np.category = 'toys'
WHEN NOT MATCHED THEN  
  INSERT VALUES (np.product_id, np.product_name, np.category || 'DEF', np.total + 100)
  WHERE np.category != 'books' AND np.total > 100;
SELECT * FROM Products_Row ORDER BY 1;
 product_id | product_name | category  | total 
------------+--------------+-----------+-------
       1501 | vivitar 35mm | electrncs |   100
       1502 | olympus is50 | electrncs |   100
       1600 | play gym     | toys      |   100
       1601 | lamaze       | toys      |   100
       1666 | harry potter | toysABC   |   300
(5 rows)

-- partitioned table
CREATE TABLE products_part
(
product_id INTEGER,
product_name VARCHAR2(60),
category VARCHAR2(60),
total INTEGER
)
PARTITION BY RANGE (product_id)
(
  PARTITION P1 VALUES LESS THAN (1600),
  PARTITION P2 VALUES LESS THAN (1700),
  PARTITION P3 VALUES LESS THAN (1800)
) ENABLE ROW MOVEMENT;
INSERT INTO products_part SELECT * FROM Products_Base;
ANALYZE products_part;
MERGE INTO products_part p
USING NewProducts_Row np
ON p.product_id = np.product_id
WHEN MATCHED THEN
  UPDATE SET product_name = np.product_name, category = np.category || 'ABC', total = np.total + 100 WHERE p.category = 'dvd'
WHEN NOT MATCHED THEN  
  INSERT VALUES (np.product_id, np.product_name, np.category || 'ABC', np.total + 100) WHERE np.category != 'books';
SELECT * FROM products_part ORDER BY 1;
 product_id | product_name | category  | total 
------------+--------------+-----------+-------
       1501 | vivitar 35mm | electrncs |   100
       1502 | olympus is50 | electrncs |   100
       1600 | play gym     | toys      |   100
       1601 | lamaze       | toys      |   100
       1666 | harry potter | toysABC   |   300
(5 rows)

-- do a simple equivalent of an INSERT SELECT
TRUNCATE Products_Row;
INSERT INTO Products_Row SELECT * FROM Products_Base;
SELECT * FROM Products_Row ORDER BY 1;
 product_id | product_name | category  | total 
------------+--------------+-----------+-------
       1501 | vivitar 35mm | electrncs |   100
       1502 | olympus is50 | electrncs |   100
       1600 | play gym     | toys      |   100
       1601 | lamaze       | toys      |   100
       1666 | harry potter | dvd       |   100
(5 rows)

SELECT * FROM NewProducts_Row ORDER BY 1;
 product_id |  product_name  | category  | total 
------------+----------------+-----------+-------
       1502 | olympus camera | electrncs |   200
       1601 | lamaze         | toys      |   200
       1666 | harry potter   | toys      |   200
       1700 | wait interface | books     |   200
(4 rows)

MERGE INTO Products_Row p
USING NewProducts_Row np
ON p.product_id = np.product_id
WHEN NOT MATCHED THEN
    INSERT VALUES (np.product_id, np.product_name, np.category, np.total);
SELECT * FROM Products_Row ORDER BY 1;
 product_id |  product_name  | category  | total 
------------+----------------+-----------+-------
       1501 | vivitar 35mm   | electrncs |   100
       1502 | olympus is50   | electrncs |   100
       1600 | play gym       | toys      |   100
       1601 | lamaze         | toys      |   100
       1666 | harry potter   | dvd       |   100
       1700 | wait interface | books     |   200
(6 rows)

-- the classic merge
TRUNCATE Products_Row;
INSERT INTO Products_Row SELECT * FROM Products_Base;
SELECT * FROM Products_Row ORDER BY 1;
 product_id | product_name | category  | total 
------------+--------------+-----------+-------
       1501 | vivitar 35mm | electrncs |   100
       1502 | olympus is50 | electrncs |   100
       1600 | play gym     | toys      |   100
       1601 | lamaze       | toys      |   100
       1666 | harry potter | dvd       |   100
(5 rows)

SELECT * FROM NewProducts_Row ORDER BY 1;
 product_id |  product_name  | category  | total 
------------+----------------+-----------+-------
       1502 | olympus camera | electrncs |   200
       1601 | lamaze         | toys      |   200
       1666 | harry potter   | toys      |   200
       1700 | wait interface | books     |   200
(4 rows)

MERGE INTO Products_Row p
USING NewProducts_Row np
ON p.product_id = np.product_id
WHEN NOT MATCHED THEN
    INSERT VALUES (np.product_id, np.product_name, np.category, np.total)
WHEN MATCHED THEN
    UPDATE SET product_name = p.product_name ||' + '|| np.product_name,
	           category     = p.category ||' + ' || np.category,
			   total        = p.total + np.total;
SELECT * FROM Products_Row ORDER BY 1;
 product_id |         product_name          |       category        | total 
------------+-------------------------------+-----------------------+-------
       1501 | vivitar 35mm                  | electrncs             |   100
       1502 | olympus is50 + olympus camera | electrncs + electrncs |   300
       1600 | play gym                      | toys                  |   100
       1601 | lamaze + lamaze               | toys + toys           |   300
       1666 | harry potter + harry potter   | dvd + toys            |   300
       1700 | wait interface                | books                 |   200
(6 rows)

-- do a simple equivalent of an INSERT SELECT with targetlist
TRUNCATE Products_Row;
INSERT INTO Products_Row SELECT * FROM Products_Base;
SELECT * FROM Products_Row ORDER BY 1;
 product_id | product_name | category  | total 
------------+--------------+-----------+-------
       1501 | vivitar 35mm | electrncs |   100
       1502 | olympus is50 | electrncs |   100
       1600 | play gym     | toys      |   100
       1601 | lamaze       | toys      |   100
       1666 | harry potter | dvd       |   100
(5 rows)

SELECT * FROM NewProducts_Row ORDER BY 1;
 product_id |  product_name  | category  | total 
------------+----------------+-----------+-------
       1502 | olympus camera | electrncs |   200
       1601 | lamaze         | toys      |   200
       1666 | harry potter   | toys      |   200
       1700 | wait interface | books     |   200
(4 rows)

MERGE INTO Products_Row p
USING NewProducts_Row np
ON p.product_id = np.product_id
WHEN NOT MATCHED THEN
    INSERT (product_id, product_name, total) 
	VALUES (np.product_id, np.product_name, np.total);
SELECT * FROM Products_Row ORDER BY 1;
 product_id |  product_name  | category  | total 
------------+----------------+-----------+-------
       1501 | vivitar 35mm   | electrncs |   100
       1502 | olympus is50   | electrncs |   100
       1600 | play gym       | toys      |   100
       1601 | lamaze         | toys      |   100
       1666 | harry potter   | dvd       |   100
       1700 | wait interface | unknown   |   200
(6 rows)

-- the on clause is true
TRUNCATE Products_Row;
INSERT INTO Products_Row SELECT * FROM Products_Base;
SELECT * FROM Products_Row ORDER BY 1;
 product_id | product_name | category  | total 
------------+--------------+-----------+-------
       1501 | vivitar 35mm | electrncs |   100
       1502 | olympus is50 | electrncs |   100
       1600 | play gym     | toys      |   100
       1601 | lamaze       | toys      |   100
       1666 | harry potter | dvd       |   100
(5 rows)

SELECT * FROM NewProducts_Row ORDER BY 1;
 product_id |  product_name  | category  | total 
------------+----------------+-----------+-------
       1502 | olympus camera | electrncs |   200
       1601 | lamaze         | toys      |   200
       1666 | harry potter   | toys      |   200
       1700 | wait interface | books     |   200
(4 rows)

MERGE INTO Products_Row p
USING NewProducts_Row np
ON (select true)
WHEN NOT MATCHED THEN
    INSERT (product_id, product_name, total) 
	VALUES (np.product_id, np.product_name, np.total);
SELECT * FROM Products_Row ORDER BY 1;
 product_id | product_name | category  | total 
------------+--------------+-----------+-------
       1501 | vivitar 35mm | electrncs |   100
       1502 | olympus is50 | electrncs |   100
       1600 | play gym     | toys      |   100
       1601 | lamaze       | toys      |   100
       1666 | harry potter | dvd       |   100
(5 rows)

--subquery
TRUNCATE Products_Row;
INSERT INTO Products_Row SELECT * FROM Products_Base;
MERGE INTO Products_Row p
USING (select * from NewProducts_Row ) np
ON p.product_id = np.product_id
WHEN MATCHED THEN 
	UPDATE SET product_name = p.product_name, category = p.category || 'ABC', total = p.total + 100
WHEN NOT MATCHED THEN
	INSERT VALUES (np.product_id, np.product_name, np.category || 'DEF', np.total + 200);
SELECT * FROM Products_Row ORDER BY 1;
 product_id |  product_name  |   category   | total 
------------+----------------+--------------+-------
       1501 | vivitar 35mm   | electrncs    |   100
       1502 | olympus is50   | electrncsABC |   200
       1600 | play gym       | toys         |   100
       1601 | lamaze         | toysABC      |   200
       1666 | harry potter   | dvdABC       |   200
       1700 | wait interface | booksDEF     |   400
(6 rows)

--subquery with expression
TRUNCATE Products_Row;
INSERT INTO Products_Row SELECT * FROM Products_Base;
MERGE INTO Products_Row p
USING (select * from NewProducts_Row ) np
ON p.product_id = np.product_id
WHEN MATCHED THEN 
	UPDATE SET product_name = p.product_name, category = p.category || 'ABC', total = p.total + 100 WHERE np.product_name ='lamaze'
WHEN NOT MATCHED THEN
	INSERT VALUES (np.product_id, np.product_name, np.category || 'DEF', np.total + 200) WHERE np.product_name = 'wait interface';
SELECT * FROM Products_Row order by 1;
 product_id |  product_name  | category  | total 
------------+----------------+-----------+-------
       1501 | vivitar 35mm   | electrncs |   100
       1502 | olympus is50   | electrncs |   100
       1600 | play gym       | toys      |   100
       1601 | lamaze         | toysABC   |   200
       1666 | harry potter   | dvd       |   100
       1700 | wait interface | booksDEF  |   400
(6 rows)

--subquery with expression
TRUNCATE Products_Row;
INSERT INTO Products_Row SELECT * FROM Products_Base;
MERGE INTO Products_Row p
USING (select sp.product_id, sp.product_name, snp.category, snp.total from NewProducts_Row snp, Products_Row sp where sp.product_id = snp.product_id) np
ON p.product_id = np.product_id
WHEN MATCHED THEN 
	UPDATE SET product_name = p.product_name, category = p.category || 'ABC', total = p.total + 100 WHERE product_name ='lamaze'
WHEN NOT MATCHED THEN
	INSERT VALUES (np.product_id, np.product_name, np.category || 'DEF', np.total + 200) WHERE np.product_name = 'wait interface';
SELECT * FROM Products_Row order by 1;
 product_id | product_name | category  | total 
------------+--------------+-----------+-------
       1501 | vivitar 35mm | electrncs |   100
       1502 | olympus is50 | electrncs |   100
       1600 | play gym     | toys      |   100
       1601 | lamaze       | toysABC   |   200
       1666 | harry potter | dvd       |   100
(5 rows)

--subquery has constant
TRUNCATE Products_Row;
INSERT INTO Products_Row SELECT * FROM Products_Base;
MERGE INTO Products_Row p
USING (
select 1501 as product_id, 'vivitar 35mm' as product_name, 'electrncs' as category, 100 as total union all
select 1502 as product_id, 'olympus is50' as product_name, 'electrncs' as category, 100 as total union all
select 1600 as product_id, 'play gym' as product_name, 'toys' as category, 100 as total union all
select 1601 as product_id, 'lamaze' as product_name, 'toys' as category, 100 as total union all
select 1666 as product_id, 'harry potter' as product_name, 'dvd' as category, 100 as total
 ) np
ON p.product_id = np.product_id
WHEN MATCHED THEN 
	UPDATE SET product_name = p.product_name, category = p.category || 'ABC', total = p.total + 100
WHEN NOT MATCHED THEN
	INSERT VALUES (np.product_id, np.product_name, np.category || 'DEF', np.total + 200);
SELECT * FROM Products_Row ORDER BY 1;
 product_id | product_name |   category   | total 
------------+--------------+--------------+-------
       1501 | vivitar 35mm | electrncsABC |   200
       1502 | olympus is50 | electrncsABC |   200
       1600 | play gym     | toysABC      |   200
       1601 | lamaze       | toysABC      |   200
       1666 | harry potter | dvdABC       |   200
(5 rows)

--subquery has aggeration
TRUNCATE Products_Row;
INSERT INTO Products_Row SELECT * FROM Products_Base;
MERGE INTO Products_Row p
USING (
select product_id, product_name, category, sum(total) as total from NewProducts_Row group by product_id, product_name, category
 ) np
ON p.product_id = np.product_id
WHEN MATCHED THEN 
	UPDATE SET product_name = p.product_name, category = p.category || 'ABC', total = p.total + 100
WHEN NOT MATCHED THEN
	INSERT VALUES (np.product_id, np.product_name, np.category || 'DEF', np.total + 200);
SELECT * FROM Products_Row ORDER BY 1;
 product_id |  product_name  |   category   | total 
------------+----------------+--------------+-------
       1501 | vivitar 35mm   | electrncs    |   100
       1502 | olympus is50   | electrncsABC |   200
       1600 | play gym       | toys         |   100
       1601 | lamaze         | toysABC      |   200
       1666 | harry potter   | dvdABC       |   200
       1700 | wait interface | booksDEF     |   400
(6 rows)

--subquery has aggeration
TRUNCATE Products_Row;
INSERT INTO Products_Row SELECT * FROM Products_Base;
MERGE INTO Products_Row p
USING (
select product_id, product_name, category, sum(total) as total
from NewProducts_Row
group by product_id, product_name, category
having sum(total)>100
order by total
 ) np
ON p.product_id = np.product_id
WHEN MATCHED THEN 
	UPDATE SET product_name = p.product_name, category = p.category || 'ABC', total = p.total + 100
WHEN NOT MATCHED THEN
	INSERT VALUES (np.product_id, np.product_name, np.category || 'DEF', np.total + 200);
SELECT * FROM Products_Row ORDER BY 1;
 product_id |  product_name  |   category   | total 
------------+----------------+--------------+-------
       1501 | vivitar 35mm   | electrncs    |   100
       1502 | olympus is50   | electrncsABC |   200
       1600 | play gym       | toys         |   100
       1601 | lamaze         | toysABC      |   200
       1666 | harry potter   | dvdABC       |   200
       1700 | wait interface | booksDEF     |   400
(6 rows)

--source table have a view
TRUNCATE Products_Row;
INSERT INTO Products_Row SELECT * FROM Products_Base;
CREATE VIEW v AS (SELECT * FROM NewProducts_Row WHERE total > 100);
MERGE INTO Products_Row p
USING v np
ON p.product_id = np.product_id
WHEN MATCHED THEN 
	UPDATE SET product_name = p.product_name, category = p.category || 'ABC', total = p.total + 100
WHEN NOT MATCHED THEN
	INSERT VALUES (np.product_id, np.product_name, np.category || 'DEF', np.total + 200);
SELECT * FROM Products_Row ORDER BY 1;
 product_id |  product_name  |   category   | total 
------------+----------------+--------------+-------
       1501 | vivitar 35mm   | electrncs    |   100
       1502 | olympus is50   | electrncsABC |   200
       1600 | play gym       | toys         |   100
       1601 | lamaze         | toysABC      |   200
       1666 | harry potter   | dvdABC       |   200
       1700 | wait interface | booksDEF     |   400
(6 rows)

--self merge
TRUNCATE Products_Row;
INSERT INTO Products_Row SELECT * FROM Products_Base;
BEGIN;
MERGE INTO Products_Row p
USING Products_Row np
ON p.product_id = np.product_id
WHEN MATCHED THEN 
	UPDATE SET product_name = p.product_name, category = p.category || 'ABC', total = p.total + 100
WHEN NOT MATCHED THEN
	INSERT VALUES (np.product_id, np.product_name, np.category || 'DEF', np.total + 200);
SELECT * FROM Products_Row ORDER BY 1;
 product_id | product_name |   category   | total 
------------+--------------+--------------+-------
       1501 | vivitar 35mm | electrncsABC |   200
       1502 | olympus is50 | electrncsABC |   200
       1600 | play gym     | toysABC      |   200
       1601 | lamaze       | toysABC      |   200
       1666 | harry potter | dvdABC       |   200
(5 rows)

ROLLBACK;
-- Function scans
CREATE TABLE fs_target (a int, b int, c text);
MERGE INTO fs_target t
USING generate_series(1,100,1) AS id
ON t.a = id
WHEN MATCHED THEN
    UPDATE SET b = b + id
WHEN NOT MATCHED THEN
    INSERT VALUES (id, -1);
MERGE INTO fs_target t
USING generate_series(1,100,2) AS id
ON t.a = id
WHEN MATCHED THEN
    UPDATE SET b = b + id, c = 'updated '|| id.*::text
WHEN NOT MATCHED THEN
    INSERT VALUES (id, -1, 'inserted ' || id.*::text);
SELECT count(*) FROM fs_target;
 count 
-------
   100
(1 row)

DROP TABLE fs_target;
--default values for insert values
BEGIN;
MERGE INTO Products_Row p
USING NewProducts_Row np
ON p.product_id = np.product_id
WHEN NOT MATCHED THEN
  INSERT VALUES (DEFAULT);
MERGE INTO Products_Row p
USING NewProducts_Row np
ON p.product_id = np.product_id
WHEN NOT MATCHED THEN
  INSERT VALUES (DEFAULT, np.product_name, np.category, DEFAULT);
MERGE INTO Products_Row p
USING NewProducts_Row np
ON p.product_id = np.product_id
WHEN NOT MATCHED THEN
  INSERT DEFAULT VALUES;
select * from  Products_Row order by 1,2,3,4;
 product_id |  product_name  | category  | total 
------------+----------------+-----------+-------
          0 | null           | unknown   |     0
          0 | null           | unknown   |     0
          0 | wait interface | books     |     0
       1501 | vivitar 35mm   | electrncs |   100
       1502 | olympus is50   | electrncs |   100
       1600 | play gym       | toys      |   100
       1601 | lamaze         | toys      |   100
       1666 | harry potter   | dvd       |   100
(8 rows)

ROLLBACK;
--default values for update values
BEGIN;
MERGE INTO Products_Row p
USING NewProducts_Row np
ON p.product_id = np.product_id
WHEN MATCHED THEN
  UPDATE SET product_name = DEFAULT, category = DEFAULT, total = DEFAULT 
WHEN NOT MATCHED THEN
  INSERT VALUES (DEFAULT);
select * from  Products_Row order by 1;  
 product_id | product_name | category  | total 
------------+--------------+-----------+-------
          0 | null         | unknown   |     0
       1501 | vivitar 35mm | electrncs |   100
       1502 | null         | unknown   |     0
       1600 | play gym     | toys      |   100
       1601 | null         | unknown   |     0
       1666 | null         | unknown   |     0
(6 rows)

ROLLBACK;
----------------------plpgsql-----------------------------------
BEGIN;
DO LANGUAGE plpgsql $$
BEGIN
MERGE INTO Products_Row p
USING NewProducts_Row np
ON p.product_id = np.product_id
WHEN MATCHED THEN
  UPDATE SET product_name = np.product_name, category = np.category , total = np.total
WHEN NOT MATCHED THEN
  INSERT VALUES (np.product_id, np.product_name, np.category, np.total);
END;
$$;
SELECT * FROM Products_Row order by 1;
 product_id |  product_name  | category  | total 
------------+----------------+-----------+-------
       1501 | vivitar 35mm   | electrncs |   100
       1502 | olympus camera | electrncs |   200
       1600 | play gym       | toys      |   100
       1601 | lamaze         | toys      |   200
       1666 | harry potter   | toys      |   200
       1700 | wait interface | books     |   200
(6 rows)

ROLLBACK;
--NON ANOYBLOCK 
BEGIN;
BEGIN
MERGE INTO Products_Row p
USING NewProducts_Row np
ON p.product_id = np.product_id
WHEN MATCHED THEN
  UPDATE SET product_name = np.product_name, category = np.category , total = np.total
WHEN NOT MATCHED THEN
  INSERT VALUES (np.product_id, np.product_name, np.category, np.total);
END;
/
SELECT * FROM Products_Row order by 1;
 product_id |  product_name  | category  | total 
------------+----------------+-----------+-------
       1501 | vivitar 35mm   | electrncs |   100
       1502 | olympus camera | electrncs |   200
       1600 | play gym       | toys      |   100
       1601 | lamaze         | toys      |   200
       1666 | harry potter   | toys      |   200
       1700 | wait interface | books     |   200
(6 rows)

ROLLBACK;
--stored procedure
create or replace procedure p1()
AS
BEGIN
	MERGE INTO Products_Row p
	USING NewProducts_Row np
	ON p.product_id = np.product_id
	WHEN MATCHED THEN
	  UPDATE SET product_name = np.product_name, category = np.category , total = np.total
	WHEN NOT MATCHED THEN
	  INSERT VALUES (np.product_id, np.product_name, np.category, np.total);
END;
/
BEGIN;
select p1();
 p1 
----
 
(1 row)

SELECT * FROM Products_Row order by 1;
 product_id |  product_name  | category  | total 
------------+----------------+-----------+-------
       1501 | vivitar 35mm   | electrncs |   100
       1502 | olympus camera | electrncs |   200
       1600 | play gym       | toys      |   100
       1601 | lamaze         | toys      |   200
       1666 | harry potter   | toys      |   200
       1700 | wait interface | books     |   200
(6 rows)

ROLLBACK;
--stored procedure with params in insert targetlist
create or replace procedure p2( param1 IN text)
AS
BEGIN
	MERGE INTO Products_Row p
	USING NewProducts_Row np
	ON p.product_id = np.product_id
	WHEN MATCHED THEN
	  UPDATE SET product_name = np.product_name, category = np.category , total = np.total
	WHEN NOT MATCHED THEN
	  INSERT VALUES (np.product_id, 'inserted by proc', param1, np.total);
END;
/
BEGIN;
select p2('param1');
 p2 
----
 
(1 row)

SELECT * FROM Products_Row order by 1;
 product_id |   product_name   | category  | total 
------------+------------------+-----------+-------
       1501 | vivitar 35mm     | electrncs |   100
       1502 | olympus camera   | electrncs |   200
       1600 | play gym         | toys      |   100
       1601 | lamaze           | toys      |   200
       1666 | harry potter     | toys      |   200
       1700 | inserted by proc | param1    |   200
(6 rows)

ROLLBACK;
BEGIN;
select p2('param2');
 p2 
----
 
(1 row)

SELECT * FROM Products_Row order by 1;
 product_id |   product_name   | category  | total 
------------+------------------+-----------+-------
       1501 | vivitar 35mm     | electrncs |   100
       1502 | olympus camera   | electrncs |   200
       1600 | play gym         | toys      |   100
       1601 | lamaze           | toys      |   200
       1666 | harry potter     | toys      |   200
       1700 | inserted by proc | param2    |   200
(6 rows)

ROLLBACK;
--stored procedure with params in update targetlist
create or replace procedure p3( param1 IN text)
AS
BEGIN
	MERGE INTO Products_Row p
	USING NewProducts_Row np
	ON p.product_id = np.product_id
	WHEN MATCHED THEN
	  UPDATE SET product_name = np.product_name, category = param1 , total = np.total
	WHEN NOT MATCHED THEN
	  INSERT VALUES (np.product_id, 'inserted by proc', np.category, np.total);
END;
/
BEGIN;
select p3('param1');
 p3 
----
 
(1 row)

SELECT * FROM Products_Row order by 1;
 product_id |   product_name   | category  | total 
------------+------------------+-----------+-------
       1501 | vivitar 35mm     | electrncs |   100
       1502 | olympus camera   | param1    |   200
       1600 | play gym         | toys      |   100
       1601 | lamaze           | param1    |   200
       1666 | harry potter     | param1    |   200
       1700 | inserted by proc | books     |   200
(6 rows)

ROLLBACK;
BEGIN;
select p3('param2');
 p3 
----
 
(1 row)

SELECT * FROM Products_Row order by 1;
 product_id |   product_name   | category  | total 
------------+------------------+-----------+-------
       1501 | vivitar 35mm     | electrncs |   100
       1502 | olympus camera   | param2    |   200
       1600 | play gym         | toys      |   100
       1601 | lamaze           | param2    |   200
       1666 | harry potter     | param2    |   200
       1700 | inserted by proc | books     |   200
(6 rows)

ROLLBACK;
--stored procedure with params in where conditions
create or replace procedure p4( param1 IN text)
AS
BEGIN
	MERGE INTO Products_Row p
	USING NewProducts_Row np
	ON p.product_id = np.product_id
	WHEN MATCHED THEN
	  UPDATE SET product_name = np.product_name, category = np.category || 'DEF' , total = np.total
	  WHERE category = param1
	WHEN NOT MATCHED THEN
	  INSERT VALUES (np.product_id, 'inserted by proc', np.category, np.total);
END;
/
BEGIN;
select p4('toys'); --only update toys
 p4 
----
 
(1 row)

SELECT * FROM Products_Row order by 1;
 product_id |   product_name   | category  | total 
------------+------------------+-----------+-------
       1501 | vivitar 35mm     | electrncs |   100
       1502 | olympus is50     | electrncs |   100
       1600 | play gym         | toys      |   100
       1601 | lamaze           | toysDEF   |   200
       1666 | harry potter     | dvd       |   100
       1700 | inserted by proc | books     |   200
(6 rows)

ROLLBACK;
BEGIN;
select p4('dvd'); --only update dvd
 p4 
----
 
(1 row)

SELECT * FROM Products_Row order by 1;
 product_id |   product_name   | category  | total 
------------+------------------+-----------+-------
       1501 | vivitar 35mm     | electrncs |   100
       1502 | olympus is50     | electrncs |   100
       1600 | play gym         | toys      |   100
       1601 | lamaze           | toys      |   100
       1666 | harry potter     | toysDEF   |   200
       1700 | inserted by proc | books     |   200
(6 rows)

ROLLBACK;
BEGIN;
select p4('electrncs'); --only update electrncs
 p4 
----
 
(1 row)

SELECT * FROM Products_Row order by 1;
 product_id |   product_name   |   category   | total 
------------+------------------+--------------+-------
       1501 | vivitar 35mm     | electrncs    |   100
       1502 | olympus camera   | electrncsDEF |   200
       1600 | play gym         | toys         |   100
       1601 | lamaze           | toys         |   100
       1666 | harry potter     | dvd          |   100
       1700 | inserted by proc | books        |   200
(6 rows)

ROLLBACK;
--update index
create table src(a bigint, b bigint, c varchar(1000));
create table des(a bigint, b bigint, c varchar(1000));
create index src_i on src(b);
create index des_i on des(b);
insert into des values(generate_series(1,10), generate_series(1,10), 'des');
insert into src values(generate_series(1,10), generate_series(1,10), 'src');
insert into src (select a+100, b+100, c from src);
insert into src (select a+1000, b+1000, c from src);
insert into src (select a+10000, b+10000, c from src);
insert into src (select a+100000, b+100000, c from src);
insert into src (select a+1000000, b+1000000, c from src);
insert into src (select a+10000000, b+10000000, c from src);
insert into src (select a+100000000, b+100000000, c from src);
insert into src (select a+1000000000, b+100000000, c from src);
insert into src (select a+10000000000, b+100000000, c from src);
insert into des (select a+100, b+100, c from des);
insert into des (select a+1000, b+1000, c from des);
insert into des (select a+10000, b+10000, c from des);
insert into des (select a+100000, b+100000, c from des);
insert into des (select a+1000000, b+1000000, c from des);
insert into des (select a+10000000, b+10000000, c from des);
insert into des (select a+100000000, b+100000000, c from des);
insert into des (select a+1000000000, b+1000000000, c from des);
insert into des (select a+10000000000, b+1000000000, c from des);
MERGE INTO des d
USING src s
ON d.a = s.a
WHEN MATCHED THEN
  UPDATE SET b = s.b + 10, c = s.c
WHEN NOT MATCHED THEN
  INSERT VALUES (s.a, s.b);
--rows shall be the same
select count(*) from src;
 count 
-------
  5120
(1 row)

select count(*) from des;
 count 
-------
  5120
(1 row)

--column b of des is 10 bigger than src
select * from src where a = 105;
  a  |  b  |  c  
-----+-----+-----
 105 | 105 | src
(1 row)

select * from des where b = 115;
  a  |  b  |  c  
-----+-----+-----
 105 | 115 | src
(1 row)

drop table des;
drop table src;
--dropped column and add column
BEGIN;
ALTER TABLE Products_Row DROP COLUMN category;
MERGE INTO Products_Row p
USING NewProducts_Row np
ON p.product_id = np.product_id
WHEN NOT MATCHED THEN
    INSERT VALUES (np.product_id, np.product_name, np.total)
WHEN MATCHED THEN
    UPDATE SET product_name = p.product_name ||' + '|| np.product_name,
			   total        = p.total + np.total;
SELECT * FROM Products_Row ORDER BY 1;
 product_id |         product_name          | total 
------------+-------------------------------+-------
       1501 | vivitar 35mm                  |   100
       1502 | olympus is50 + olympus camera |   300
       1600 | play gym                      |   100
       1601 | lamaze + lamaze               |   300
       1666 | harry potter + harry potter   |   300
       1700 | wait interface                |   200
(6 rows)

TRUNCATE Products_Row;
ALTER TABLE Products_Row ADD COLUMN category VARCHAR;
INSERT INTO Products_Row SELECT product_id,product_name,total,category FROM Products_Base;
MERGE INTO Products_Row p
USING NewProducts_Row np
ON p.product_id = np.product_id
WHEN NOT MATCHED THEN
    INSERT VALUES (np.product_id, np.product_name, np.total)
WHEN MATCHED THEN
    UPDATE SET product_name = p.product_name ||' + '|| np.product_name,
			   total        = p.total + np.total;
SELECT * FROM Products_Row ORDER BY 1;
 product_id |         product_name          | total | category  
------------+-------------------------------+-------+-----------
       1501 | vivitar 35mm                  |   100 | electrncs
       1502 | olympus is50 + olympus camera |   300 | electrncs
       1600 | play gym                      |   100 | toys
       1601 | lamaze + lamaze               |   300 | toys
       1666 | harry potter + harry potter   |   300 | dvd
       1700 | wait interface                |   200 | 
(6 rows)

ROLLBACK;
--join key diffs from distribute key
BEGIN;
MERGE INTO Products_Row p
USING NewProducts_Row np
ON p.total = np.product_id
WHEN NOT MATCHED THEN
    INSERT VALUES (np.product_id, np.product_name, np.category, np.total);
SELECT * FROM Products_Row ORDER BY 1,2,3,4;
 product_id |  product_name  | category  | total 
------------+----------------+-----------+-------
       1501 | vivitar 35mm   | electrncs |   100
       1502 | olympus camera | electrncs |   200
       1502 | olympus is50   | electrncs |   100
       1600 | play gym       | toys      |   100
       1601 | lamaze         | toys      |   100
       1601 | lamaze         | toys      |   200
       1666 | harry potter   | dvd       |   100
       1666 | harry potter   | toys      |   200
       1700 | wait interface | books     |   200
(9 rows)

ROLLBACK;
BEGIN;
MERGE INTO Products_Row p
USING NewProducts_Row np
ON p.total = np.product_id
WHEN MATCHED THEN
    UPDATE SET product_name = p.product_name ||' + '|| np.product_name;
SELECT * FROM Products_Row ORDER BY 1;
 product_id | product_name | category  | total 
------------+--------------+-----------+-------
       1501 | vivitar 35mm | electrncs |   100
       1502 | olympus is50 | electrncs |   100
       1600 | play gym     | toys      |   100
       1601 | lamaze       | toys      |   100
       1666 | harry potter | dvd       |   100
(5 rows)

ROLLBACK;
BEGIN;
MERGE INTO Products_Row p
USING NewProducts_Row np
ON p.total = np.product_id
WHEN NOT MATCHED THEN
    INSERT VALUES (np.product_id, np.product_name, np.category, np.total)
WHEN MATCHED THEN
    UPDATE SET product_name = p.product_name ||' + '|| np.product_name;
SELECT * FROM Products_Row ORDER BY 1,2,3,4;
 product_id |  product_name  | category  | total 
------------+----------------+-----------+-------
       1501 | vivitar 35mm   | electrncs |   100
       1502 | olympus camera | electrncs |   200
       1502 | olympus is50   | electrncs |   100
       1600 | play gym       | toys      |   100
       1601 | lamaze         | toys      |   100
       1601 | lamaze         | toys      |   200
       1666 | harry potter   | dvd       |   100
       1666 | harry potter   | toys      |   200
       1700 | wait interface | books     |   200
(9 rows)

ROLLBACK;
BEGIN;
MERGE INTO Products_Row p
USING NewProducts_Row np
ON p.total = np.total
WHEN NOT MATCHED THEN
    INSERT VALUES (np.product_id, np.product_name, np.category, np.total);
SELECT * FROM Products_Row ORDER BY 1,2,3,4;
 product_id |  product_name  | category  | total 
------------+----------------+-----------+-------
       1501 | vivitar 35mm   | electrncs |   100
       1502 | olympus camera | electrncs |   200
       1502 | olympus is50   | electrncs |   100
       1600 | play gym       | toys      |   100
       1601 | lamaze         | toys      |   100
       1601 | lamaze         | toys      |   200
       1666 | harry potter   | dvd       |   100
       1666 | harry potter   | toys      |   200
       1700 | wait interface | books     |   200
(9 rows)

ROLLBACK;
BEGIN;
MERGE INTO Products_Row p
USING NewProducts_Row np
ON p.total = np.total
WHEN MATCHED THEN
    UPDATE SET product_name = p.product_name ||' + '|| np.product_name;
SELECT * FROM Products_Row ORDER BY 1;
 product_id | product_name | category  | total 
------------+--------------+-----------+-------
       1501 | vivitar 35mm | electrncs |   100
       1502 | olympus is50 | electrncs |   100
       1600 | play gym     | toys      |   100
       1601 | lamaze       | toys      |   100
       1666 | harry potter | dvd       |   100
(5 rows)

ROLLBACK;
BEGIN;
MERGE INTO Products_Row p
USING NewProducts_Row np
ON p.total = np.total
WHEN NOT MATCHED THEN
    INSERT VALUES (np.product_id, np.product_name, np.category, np.total)
WHEN MATCHED THEN
    UPDATE SET product_name = p.product_name ||' + '|| np.product_name;
SELECT * FROM Products_Row ORDER BY 1,2,3,4;
 product_id |  product_name  | category  | total 
------------+----------------+-----------+-------
       1501 | vivitar 35mm   | electrncs |   100
       1502 | olympus camera | electrncs |   200
       1502 | olympus is50   | electrncs |   100
       1600 | play gym       | toys      |   100
       1601 | lamaze         | toys      |   100
       1601 | lamaze         | toys      |   200
       1666 | harry potter   | dvd       |   100
       1666 | harry potter   | toys      |   200
       1700 | wait interface | books     |   200
(9 rows)

ROLLBACK;
